found_country,used,continent,address,country_name,latitude,alt_addr,country_code,longitude
True,0,North America,"Washington, District of Columbia, USA",USA,38.8950368,,US,-77.0365427
True,0,North America,"Hope, Hempstead, Arkansas, USA",USA,33.6670616,,US,-93.5915665
True,0,North America,"Chicago, Cook, Illinois, USA",USA,41.8755616,,US,-87.6244212
True,0,North America,"Sherman, Grayson, Texas, USA",USA,33.6398609,,US,-96.6089146
True,0,North America,"Missouri, USA",USA,38.7604815,,US,-92.5617875
True,0,North America,"Sikeston, Scott, Missouri, USA",USA,36.876719,,US,-89.5878579
True,0,North America,"Bodcaw, Nevada, Arkansas, USA",USA,33.5579004,,US,-93.4063842
True,0,North America,"Tippah, Mississippi, USA",USA,34.7296814,,US,-88.9119403
True,0,North America,"Grayson, Texas, USA",USA,33.5636114,,US,-96.6702111
True,0,North America,"Parker Twp, Nevada, Arkansas, USA",USA,33.6413476,,US,-93.3055491
True,0,North America,"Falkner, Tippah, Mississippi, USA",USA,34.8420376,,US,-88.934228
True,0,North America,"Franklin, Georgia, USA",USA,34.3678642,,US,-83.2156575
True,0,North America,"Florida, USA",USA,27.7567667,,US,-81.4639835
True,0,North America,"Kossuth, Alcorn, Mississippi, USA",USA,34.8732672,,US,-88.6405963
True,0,North America,"Coffee, Alabama, USA",USA,31.3629619,,US,-85.9870669
True,0,North America,"Red Level, Covington, Alabama, USA",USA,31.4071111,,US,-86.6121861
True,0,North America,"Covington, Alabama, USA",USA,31.196549,,US,-86.4597236
True,0,North America,"Butler, Alabama, USA",USA,31.7340713,,US,-86.6754793
True,0,North America,"Ebenezer Cemetery, Parker, Nevada, Arkansas, USA",USA,33.6413476,,US,-93.3055491
True,0,North America,"Union, Louisiana, USA",USA,32.8385899,,US,-92.3910295
True,0,North America,"Oak Grove Cemetery, DeRoan Twp, Hempstead, Arkansas, USA",USA,33.6949319,,US,-93.6929825
True,0,North America,"Hempstead, Arkansas, USA",USA,33.6949319,,US,-93.6929825
True,0,North America,"Alabama, USA",USA,33.2588817,,US,-86.8295337
True,0,North America,"Rutherford, Tennessee, USA",USA,35.8563421,,US,-86.4205249
True,0,North America,"Tennessee, USA",USA,35.7730076,,US,-86.2820081
True,0,North America,"Parker, Texas, USA",USA,32.7772597,,US,-97.8045599
True,0,North America,"North Carolina, USA",USA,35.6729639,,US,-79.0392919
True,0,North America,"Ripley, Tippah, Mississippi, USA",USA,34.7307014,,US,-88.9488276
True,0,Europe,Ireland,Ireland,52.865196,,IE,-7.9794599
True,0,North America,"Carnesville, Franklin, Georgia, USA",USA,34.3698266,,US,-83.235155
True,0,North America,"Chesterfield, South Carolina, USA",USA,34.6500578,,US,-80.1417843
True,0,North America,"Early, Georgia, USA",USA,31.3454341,,US,-84.9282058
True,0,North America,"South Carolina, USA",USA,33.6874388,,US,-80.4363743
True,0,North America,"Kershaw, South Carolina, USA",USA,34.3334398,,US,-80.5669895
True,0,North America,"Shover Springs, Hempstead, Arkansas, USA",USA,33.6228953,,US,-93.5304543
True,0,North America,"McMinn, Tennessee, USA",USA,35.444223,,US,-84.624875
True,0,North America,"Arkansas, USA",USA,35.2048883,,US,-92.4479108
True,0,North America,"Union, Mississippi, USA",USA,34.4834555,,US,-88.9789198
True,0,North America,"Marshall, Mississippi, USA",USA,34.7329208,,US,-89.4725635
True,0,North America,"Randolph, North Carolina, USA",USA,35.7142874,,US,-79.7975166
True,0,North America,"Kentucky, USA",USA,37.5726028,,US,-85.1551411
True,0,North America,"Anson, North Carolina, USA",USA,34.9705848,,US,-80.0958187
True,0,North America,"Orangeburg, South Carolina, USA",USA,33.4918203,,US,-80.8556476
True,0,North America,"Longstreet, Coffee, Alabama, USA",USA,31.3629619,,US,-85.9870669
True,0,North America,"Darlington, Darlington, South Carolina, USA",USA,34.3028537,,US,-79.8710831
True,0,North America,"Ramer, Montgomery, Alabama, USA",USA,32.0500362,,US,-86.2199457
True,0,North America,"Montgomery, Alabama, USA",USA,32.3777111,,US,-86.3090775
True,0,North America,"Mt. Pleasant, Crenshaw, Alabama, USA",USA,31.8324874,,US,-86.3114018
True,0,North America,"Crenshaw, Alabama, USA",USA,31.6809362,,US,-86.3244009
True,0,North America,"Lincoln, North Carolina, USA",USA,35.4866424,,US,-81.2062724
True,0,North America,"Macon, Tennessee, USA",USA,36.5237906,,US,-86.0130908
True,0,North America,"Little Rock, Pulaski, Arkansas, USA",USA,34.7465071,,US,-92.2896267
True,0,Europe,"Tipperary, Ireland",Ireland,52.4734839,,IE,-8.1614446
True,0,Europe,"London, England",England,51.5074456,,GB,-0.1277653
True,0,North America,"Java, Wyoming, New York, USA",USA,42.6609691,,US,-78.3886656
True,0,North America,"Fulton, Whiteside, Illinois, USA",USA,41.8662157,,US,-90.1657833
True,0,North America,"Beverly Hills, Los Angeles, California, USA",USA,34.0696501,,US,-118.3963062
True,0,North America,"Illinois, USA",USA,40.0796606,,US,-89.4337288
True,0,North America,"Clarkson, Monroe, New York, USA",USA,43.233116,,US,-77.927513
True,0,North America,"New York, USA",USA,40.7127281,,US,-74.0060152
True,0,Europe,"Renfrewshire, Scotland",Scotland,55.833333,,GB,-4.5
True,0,North America,"Queens, New Brunswick, Canada",Canada,45.8838758,,CA,-65.9861428
True,0,Europe,"Argyle, Scotland",Scotland,55.9523918,,GB,-3.2086898
True,0,Europe,"Paisley, Renfrewshire, Scotland",Scotland,55.8455828,,GB,-4.4239646
True,0,Europe,"Surrey, England",England,51.2715316,,GB,-0.3414524
True,0,North America,"Clyde Twp, Whiteside, Illinois, USA",USA,41.7612332,,US,-89.9214744
True,0,North America,"Tampico, Whiteside, Illinois, USA",USA,41.6324811,,US,-89.7850393
True,0,Europe,"Epson, Surrey, England",England,51.2715316,,GB,-0.3414524
True,0,Europe,England,England,52.5310214,,GB,-1.2649062
True,0,North America,"Port Tobacco, Charles, Maryland, USA",USA,38.5112633,,US,-77.0204083
True,0,North America,"Frederick, Maryland, USA",USA,39.415779,,US,-77.4127562
True,0,North America,"Charles, Maryland, USA",USA,38.4991611,,US,-77.027847
True,0,North America,"Loudon, Laurel, Kentucky, USA",USA,37.1000973,,US,-84.1148273
True,0,North America,"Anchorage, Jefferson, Kentucky, USA",USA,38.2665993,,US,-85.5330114
True,0,North America,"Galveston, Galveston, Texas, USA",USA,29.3056996,,US,-94.7933252
True,0,North America,"Jefferson, Kentucky, USA",USA,38.1787175,,US,-85.664528
True,0,North America,"Owensboro, Daviess, Kentucky, USA",USA,37.7742152,,US,-87.1133304
True,0,North America,"Russellville, Franklin, Alabama, USA",USA,34.5042652,,US,-87.7332823
True,0,North America,"Petersburg, Independent Cities, Virginia, USA",USA,37.1232245,,US,-78.4927721
True,0,North America,"Phoenix, Maricopa, Arizona, USA",USA,33.4484367,,US,-112.074141
True,0,North America,"Scottsdale, Maricopa, Arizona, USA",USA,33.4942189,,US,-111.926018
True,0,North America,"Great Barrington, Berkshire, Massachusetts, USA",USA,42.1939364,,US,-73.362773
True,0,North America,"Pittsfield, Berkshire, Massachusetts, USA",USA,42.4484778,,US,-73.2541069
True,0,North America,"Orient, Suffolk, New York, USA",USA,41.1372575,,US,-72.2795773
True,0,North America,"Manhattan, New York, New York, USA",USA,40.7579554,,US,-73.9855319
True,0,North America,"Galesburg, Knox, Illinois, USA",USA,40.9475652,,US,-90.3712169
True,0,Europe,"Galty, Knockweaddown, Ireland",Ireland,52.865196,,IE,-7.9794599
True,0,North America,"St Joseph, Andrew, Missouri, USA",USA,40.115276,,US,-94.8239361
True,0,North America,"St Marys, Elk, Pennsylvania, USA",USA,41.4280432,,US,-78.5611275
True,0,North America,"Los Angeles, Los Angeles, California, USA",USA,34.0536909,,US,-118.242766
True,0,North America,"Hempstead, Nassau, New York, USA",USA,40.6736812,,US,-73.6190736
True,0,North America,"Cape May, New Jersey, USA",USA,39.1765386,,US,-74.8012119
True,0,North America,"Smith Cemetery, Greene, Pennsylvania, USA",USA,39.9128529,,US,-80.117838
True,0,North America,"Morgan Twp, Greene, Pennsylvania, USA",USA,39.956853,,US,-80.0968188
True,0,North America,"Springfield, Columbiana, Ohio, USA",USA,40.889855,,US,-80.6785145
True,0,North America,"Shrewsbury, Monmouth, New Jersey, USA",USA,40.3295547,,US,-74.0615285
True,0,North America,"Butlerville, Jennings, Indiana, USA",USA,39.0344983,,US,-85.5127432
True,0,North America,"Jefferson Twp, Fayette, Pennsylvania, USA",USA,40.054026,,US,-79.8336541
True,0,North America,"Whittier, Los Angeles, California, USA",USA,33.9749136,,US,-118.0338664
True,0,North America,"New Jersey, USA",USA,40.0757384,,US,-74.4041622
True,0,North America,"Burlington, New Jersey, USA",USA,39.9325409,,US,-74.7226665
True,0,North America,"West Branch, Cedar, Iowa, USA",USA,41.6720735,,US,-91.3459735
True,0,North America,"Massachusetts, USA",USA,42.3788774,,US,-72.032366
True,0,North America,"Mahoning, Ohio, USA",USA,40.9830133,,US,-80.7826416
True,0,North America,"Springfield, Mahoning, Ohio, USA",USA,40.9433676,,US,-80.5754631
True,0,North America,"Baltimore, Maryland, USA",USA,39.2908816,,US,-76.610759
True,0,North America,"Gunpowder, Harford, Maryland, USA",USA,39.4374278,,US,-76.3690732
True,0,North America,"Monmouth, New Jersey, USA",USA,40.2932319,,US,-74.1671114
True,0,North America,"Richland, Bucks, Pennsylvania, USA",USA,40.4454352,,US,-75.3139227
True,0,North America,"Columbiana, Ohio, USA",USA,40.7787016,,US,-80.7648602
True,0,North America,"Colerain, Belmont, Ohio, USA",USA,40.1259045,,US,-80.8086973
True,0,North America,"Elk Twp., Vinton, Ohio, USA",USA,39.2614972,,US,-82.474952
True,0,North America,"La Habra, Orange, California, USA",USA,33.9316066,,US,-117.9454867
True,0,North America,"Yorba Linda, Orange, California, USA",USA,33.8901096,,US,-117.8249705
True,0,North America,"Ely, White Pine, Nevada, USA",USA,39.2480588,,US,-114.891718
True,0,North America,"West Point, Orange, New York, USA",USA,41.3926455,,US,-73.9599242
True,0,North America,"Muncie, Delaware, Indiana, USA",USA,40.1936892,,US,-85.3865271
True,0,North America,"Smith Twp, Washington, Pennsylvania, USA",USA,40.369102,,US,-80.3668343
True,0,North America,"Mount Pleasant, Vinton, Ohio, USA",USA,39.3928463,,US,-82.4568223
True,0,North America,"Swan, Vinton, Ohio, USA",USA,39.3360225,,US,-82.4692821
True,0,North America,"New Plymouth, Vinton, Ohio, USA",USA,39.3847914,,US,-82.3962649
True,0,North America,"Hocking, Ohio, USA",USA,39.4644491,,US,-82.5469722
True,0,North America,"Vinton, Ohio, USA",USA,39.2744355,,US,-82.4740302
True,0,North America,"Washington, Washington, Pennsylvania, USA",USA,40.1709768,,US,-80.2454528
True,0,North America,"Gettysburg, Adams, Pennsylvania, USA",USA,39.8308973,,US,-77.231012
True,0,North America,"McArthur, Vinton, Ohio, USA",USA,39.2464596,,US,-82.4784898
True,0,North America,"Harford, Maryland, USA",USA,39.548545,,US,-76.3048991
True,0,North America,"Morgan, Ohio, USA",USA,39.5943953,,US,-81.877978
True,0,North America,"Bigger Twp., Jennings, Indiana, USA",USA,38.9957749,,US,-85.6359201
True,0,North America,"West Pike Run, Washington, Pennsylvania, USA",USA,40.0428063,,US,-79.9588284
True,0,North America,"Goshen, Mahoning, Ohio, USA",USA,40.9589057,,US,-80.9152613
True,0,North America,"Middletown, Cape May, New Jersey, USA",USA,39.271226,,US,-74.7434965
True,0,Europe,"Matlock, Derbyshire, England",England,53.1374514,,GB,-1.5544694
True,0,North America,"Brandywine, New Castle, Delaware, USA",USA,39.8295563,,US,-75.5343681
True,0,North America,"Delaware, USA",USA,38.6920451,,US,-75.4013315
True,0,North America,"Fermanagh, Juniata, Pennsylvania, USA",USA,40.6129018,,US,-77.4112056
True,0,North America,"Maryland, USA",USA,39.5162401,,US,-76.9382069
True,0,North America,"Washington, Hocking, Ohio, USA",USA,39.4374403,,US,-82.4543621
True,0,North America,"Centre, Pennsylvania, USA",USA,40.9381735,,US,-77.7865722
True,0,North America,"Indianola, Warren, Iowa, USA",USA,41.3604966,,US,-93.5613292
True,0,North America,"Perry, Ohio, USA",USA,39.6370289,,US,-82.2044367
True,0,North America,"Colona, Henry, Illinois, USA",USA,41.4754634,,US,-90.3603496
True,0,North America,"Colona Twp., Henry, Illinois, USA",USA,41.3418549,,US,-90.1177442
True,0,North America,"Washington, Pennsylvania, USA",USA,40.1943798,,US,-80.2541251
True,0,North America,"Morris, New Jersey, USA",USA,40.8679538,,US,-74.5601181
True,0,North America,"Lancaster, Pennsylvania, USA",USA,40.0379958,,US,-76.3056707
True,0,North America,"Salisbury Twp., Lancaster, Pennsylvania, USA",USA,40.0403575,,US,-75.9937401
True,0,North America,"Ohio, USA",USA,40.2253569,,US,-82.6881395
True,0,North America,"Belmont, Ohio, USA",USA,40.0057737,,US,-81.0097516
True,0,North America,"Plumstead, Bucks, Pennsylvania, USA",USA,40.3862315,,US,-75.1188504
True,0,North America,"Caln, Chester, Pennsylvania, USA",USA,39.9909398,,US,-75.7802235
True,0,North America,"Warrington Twp., York, Pennsylvania, USA",USA,40.0656653,,US,-76.9368682
True,0,North America,"Clover Hill, Washington, Pennsylvania, USA",USA,40.0859059,,US,-79.97894
True,0,North America,"York, Pennsylvania, USA",USA,39.962493,,US,-76.7276989
True,0,North America,"Pennsylvania, USA",USA,40.9699889,,US,-77.7278831
True,0,Europe,Wales,Wales,52.2928116,,GB,-3.73893
True,0,North America,"Iowa, USA",USA,41.9216734,,US,-93.3122705
True,0,North America,"Upper Darby, Delaware, Pennsylvania, USA",USA,39.9284459,,US,-75.2737955
True,0,North America,"Christana, New Castle, Delaware, USA",USA,39.6159851,,US,-75.662956
True,0,North America,"Roxbury, Morris, New Jersey, USA",USA,40.9026666,,US,-74.6850935
True,0,Europe,"Balleymoney, Antrim, Northern Ireland",United Kingdom,54.715139,,GB,-6.2192038
True,0,North America,"Hampshire, West Virginia, USA",USA,39.3015109,,US,-78.6212207
True,0,Europe,"Antrim, Northern Ireland",United Kingdom,54.715139,,GB,-6.2192038
True,0,North America,"Pikeland, Chester, Pennsylvania, USA",USA,40.1003815,,US,-75.6115893
True,0,North America,"Coatesville, Chester, Pennsylvania, USA",USA,39.9831616,,US,-75.8238355
True,0,North America,"New Castle, New Castle, Delaware, USA",USA,39.6620572,,US,-75.5663132
True,0,North America,"Newberry, York, Pennsylvania, USA",USA,39.9639616,,US,-76.7366061
True,0,North America,"Framingham, Middlesex, Massachusetts, USA",USA,42.2773177,,US,-71.4165905
True,0,North America,"Northampton, Burlington, New Jersey, USA",USA,40.0362843,,US,-74.857199
True,0,North America,"Evesham, Burlington, New Jersey, USA",USA,39.851752,,US,-74.8917412
True,0,North America,"Sinking Spring, Hodgenville, Larue, Kentucky, USA",USA,37.5737487,,US,-85.740353
True,0,North America,"Springfield, Sangamon, Illinois, USA",USA,39.7990175,,US,-89.6439575
True,0,North America,"Augusta, Virginia, USA",USA,38.1793809,,US,-79.1525761
True,0,North America,"Farmington, Fulton, Illinois, USA",USA,40.6980933,,US,-90.0059483
True,0,North America,"Campbell, Kentucky, USA",USA,38.9339799,,US,-84.3715286
True,0,North America,"Gentryville, Spencer, Indiana, USA",USA,38.1042183,,US,-87.0330532
True,0,North America,"Berks, Pennsylvania, USA",USA,40.4113762,,US,-75.9433305
True,0,North America,"Freehold, Monmouth, New Jersey, USA",USA,40.2601096,,US,-74.2737573
True,0,North America,"Linville, Rockingham, Virginia, USA",USA,38.521664,,US,-78.8347536
True,0,North America,"Rockingham, Virginia, USA",USA,38.5080288,,US,-78.8949442
True,0,North America,"Smithtown, Suffolk, New York, USA",USA,40.8559314,,US,-73.2006687
True,0,North America,"McGaheysville, Rockingham, Virginia, USA",USA,38.3712399,,US,-78.7322449
True,0,North America,"Farnham, Richmond, Virginia, USA",USA,37.8854129,,US,-76.6249557
True,0,North America,"Woodtown, Nelson, Kentucky, USA",USA,37.8078463,,US,-85.4741595
True,0,North America,"Howard, Maryland, USA",USA,39.2305289,,US,-76.9166241
True,0,North America,"Hingham, Plymouth, Massachusetts, USA",USA,42.2417669,,US,-70.8897676
True,0,North America,"Amity, Berks, Pennsylvania, USA",USA,40.2679125,,US,-75.7340051
True,0,North America,"Sussex, Delaware, USA",USA,38.6908097,,US,-75.3691421
True,0,Europe,"Chester, Cheshire, England",England,53.1908873,,GB,-2.8908955
True,0,North America,"Oyster Bay, Nassau, New York, USA",USA,40.7696568,,US,-73.4998608
True,0,North America,"Richmond, Virginia, USA",USA,37.5385087,,US,-77.43428
True,0,North America,"Lancaster, Virginia, USA",USA,37.7625738,,US,-76.4723233
True,0,North America,"Annapolis, Anne Arundel, Maryland, USA",USA,38.9786401,,US,-76.492786
True,0,North America,"Anne Arundel, Maryland, USA",USA,38.9722583,,US,-76.573454
True,0,North America,"Scituate, Plymouth, Massachusetts, USA",USA,42.1924492,,US,-70.7261966
True,0,North America,"Gravesend, Long Island City, Queens, New York, USA",USA,40.7455316,,US,-73.9484995
True,0,Europe,"Kingston Deverill, Wiltshire, England",England,51.1276618,,GB,-2.2188942
True,0,North America,"Virginia, USA",USA,37.1232245,,US,-78.4927721
True,0,North America,"Piscataway, Middlesex, New Jersey, USA",USA,40.5464326,,US,-74.4660542
True,0,Europe,"Hingham, Norfolk, England",England,52.5796849,,GB,0.9845613
True,0,North America,"Hull, Norfolk, Massachusetts, USA",USA,42.2684008,,US,-70.956672
True,0,Europe,"Witchampton, Dorset, England",England,50.8579978,,GB,-2.0168718
True,0,Europe,"Caversham, Oxfordshire, England",England,51.4852222,,GB,-0.9480326
True,0,North America,"Weymouth, Norfolk, Massachusetts, USA",USA,42.2212188,,US,-70.9391625
True,0,North America,"Lexington, Fayette, Kentucky, USA",USA,38.0464066,,US,-84.4970393
True,0,North America,"Arlington, Arlington, Virginia, USA",USA,38.8809358,,US,-77.1079246
True,0,North America,"Manchester, Bennington, Vermont, USA",USA,43.176909,,US,-73.0568716
True,0,North America,"New York, New York, New York, USA",USA,40.7127281,,US,-74.0060152
True,0,North America,"Pope's Creek, Westmoreland, Virginia, USA",USA,38.1420779,,US,-76.9013489
True,0,North America,"Mount Vernon, Fairfax, Virginia, USA",USA,38.710179,,US,-77.0888199
True,0,North America,"New Kent, Virginia, USA",USA,37.4974701,,US,-76.9990453
True,0,North America,"Wakefield, Westmoreland, Virginia, USA",USA,38.1720754,,US,-76.9491371
True,0,North America,"Ferry Farm, King George, Virginia, USA",USA,38.2786312,,US,-77.175356
True,0,North America,"Fredericksburg, Spotsylvania, Virginia, USA",USA,38.2201846,,US,-77.6014545
True,0,North America,"Westmoreland, Virginia, USA",USA,38.1153203,,US,-76.7567355
True,0,North America,"Warner Hall, Gloucester, Gloucester, Virginia, USA",USA,37.3396678,,US,-76.4746982
True,0,Europe,"Whitehaven, Cumberland, England",England,54.5474199,,GB,-3.5885335
True,0,North America,"Epping Forest, Lancaster, Virginia, USA",USA,37.7913044,,US,-76.5258553
True,0,Europe,"Cheshire, England",England,53.2141028,,GB,-2.4717701
True,0,Europe,"Purleigh, Essex, England",England,51.6724344,,GB,0.695894
True,0,North America,"Washington, Westmoreland, Virginia, USA",USA,38.1918855,,US,-76.9208322
True,0,North America,"York, Virginia, USA",USA,37.2230374,,US,-76.5156945
True,0,North America,"Warner Hall, Virginia, USA",USA,37.3396678,,US,-76.4746982
True,0,North America,"Naxera, Gloucester, Virginia, USA",USA,37.3406965,,US,-76.4471701
True,0,North America,"Gloucester, Gloucester, Virginia, USA",USA,37.4148403,,US,-76.529435
True,0,Europe,"Millenbeck, Lancashire, England",England,53.8611712,,GB,-2.5650945
True,0,Europe,"Sulgrave, Northamptonshire, England",England,52.1061958,,GB,-1.1915121
True,0,Europe,"Maldon, Essex, England",England,51.731198,,GB,0.6791849
True,0,Europe,"Spratton, Northamptonshire, England",England,52.3228736,,GB,-0.9477577
True,0,Europe,"Tring, Hertfordshire, England",England,51.7940357,,GB,-0.6609205
True,0,Europe,"Gloucestershire, England",England,51.7643786,,GB,-2.1880662
True,0,Europe,"Norfolk, England",England,52.666667,,GB,1.0
True,0,Europe,"Stone Edge, Lancashire, England",England,53.8633908,,GB,-2.2075841
True,0,Europe,"Linkenholt, Hampshire, England",England,51.3198054,,GB,-1.4762773
True,0,North America,"Yorktown, York, Virginia, USA",USA,37.2356655,,US,-76.5136495
True,0,Europe,"Brington, Northamptonshire, England",England,52.2683065,,GB,-1.036296
True,0,Europe,"Tyes Hall, Cuckfield, Sussex, England",England,51.0055129,,GB,-0.1393153
True,0,Europe,"Little Creaton, Northamptonshire, England",England,52.3378983,,GB,-0.9506195
True,0,Europe,"Colne, Lancashire, England",England,53.8567728,,GB,-2.1691238
True,0,Europe,"Burnley, Lancashire, England",England,53.7907262,,GB,-2.2439196
True,0,Europe,"Saint-Martin-de-Ré, Departement de la Charente-Maritime, Poitou-Charentes, France",France,45.7447048,,FR,-0.6552529
True,0,Europe,"Nether Boddingto, Northamptonshire, England",England,52.3106138,,GB,-0.865913
True,0,Europe,"Radway Grange, Warwickshire, England",England,52.3213064,,GB,-1.5536906
True,0,Europe,"Blakesley, Northamptonshire, England",England,52.1467426,,GB,-1.0877657
True,0,Europe,"Great Creaton, Northamptonshire, England",England,52.3414301,,GB,-0.9628308
True,0,Europe,"Barnside, Lancashire, England",England,53.6688447,,GB,-2.6790876
True,0,Europe,"Faccombe, Hampshire, England",England,51.3171692,,GB,-1.4425384
True,0,Europe,"St Martin, Westminster, London, England",England,51.5088275,,GB,-0.1266769
True,0,Europe,"Scrivelsby, Lincolnshire, England",England,53.1780161,,GB,-0.1023101
True,0,North America,"Williamsburg, Independent Cities, Virginia, USA",USA,37.1232245,,US,-78.4927721
True,0,North America,"New Kent, New Kent, Virginia, USA",USA,37.511702,,US,-76.9864946
True,0,North America,"Eltham, New Kent, Virginia, USA",USA,37.5237559,,US,-76.8260735
True,0,Europe,"Althorpe, Northamptonshire, England",England,52.4035844,,GB,-0.7080124
True,0,Europe,"Picadilliy, Middlesex, England",England,51.5460558,,GB,-0.2537791
True,0,Europe,"Ashe, Musbury, Devon, England",England,50.7577146,,GB,-3.0248222
True,0,Europe,"Blenheim, Oxfordshire, England",England,51.846743,,GB,-1.3765989
True,0,North America,"Milton, Norfolk, Massachusetts, USA",USA,42.2501425,,US,-71.065573
True,0,North America,"College Station, Brazos, Texas, USA",USA,30.6183939,,US,-96.3455991
True,0,North America,"Houston, Harris, Texas, USA",USA,29.7589382,,US,-95.3676974
True,0,North America,"Rye, Westchester, New York, USA",USA,40.9821371,,US,-73.6840902
True,0,North America,"Bristol, Rhode Island, USA",USA,41.6770463,,US,-71.2661597
True,0,North America,"Bristol, Bristol, Rhode Island, USA",USA,41.6770463,,US,-71.2661597
True,0,North America,"Springport, Cayuga, New York, USA",USA,42.853434,,US,-76.6787565
True,0,North America,"Lebanon, New London, Connecticut, USA",USA,41.5901093,,US,-72.1590588
True,0,North America,"Penfield, Monroe, New York, USA",USA,43.1301133,,US,-77.4759588
True,0,North America,"Rochester, Monroe, New York, USA",USA,43.157285,,US,-77.615214
True,0,North America,"Cambridge, Washington, New York, USA",USA,43.007994,,US,-73.4392637
True,0,North America,"Cincinnati, Hamilton, Ohio, USA",USA,39.1014537,,US,-84.5124602
True,0,North America,"Ithaca, Tompkins, New York, USA",USA,42.4374175,,US,-76.5483724
True,0,North America,"Savannah, Chatham, Georgia, USA",USA,32.0790074,,US,-81.0921335
True,0,North America,"Boston, Middlesex, Massachusetts, USA",USA,42.3354481,,US,-71.1682665
True,0,North America,"Brick Church, East Orange, Essex, New Jersey, USA",USA,40.7654209,,US,-74.2189954
True,0,North America,"Columbus, Franklin, Ohio, USA",USA,39.9622601,,US,-83.0007065
True,0,North America,"Franklin, Ohio, USA",USA,39.5589474,,US,-84.3041074
True,0,North America,"Watch Hill, Rhode Island, USA",USA,41.3142611,,US,-71.849017
True,0,North America,"New York, New York, USA",USA,40.7127281,,US,-74.0060152
True,0,North America,"Walker's Pt, York, Maine, USA",USA,43.3424285,,US,-70.4597517
True,0,Europe,"Roth, Down, Northern Ireland",United Kingdom,54.3793174,,GB,-5.9694446
True,0,Europe,"Rathfriland, Down, Northern Ireland",United Kingdom,54.2381785,,GB,-6.1603136
True,0,North America,"Monroe, Missouri, USA",USA,39.494421,,US,-91.9896892
True,0,North America,"Pike, Missouri, USA",USA,39.3683251,,US,-91.1825617
True,0,North America,"St Louis, Missouri, USA",USA,38.6280278,,US,-90.1910154
True,0,North America,"Hannibal, Marion, Missouri, USA",USA,39.7082498,,US,-91.3587413
True,0,North America,"Culpeper, Virginia, USA",USA,38.4733823,,US,-77.9961275
True,0,North America,"Indian Territory, USA",USA,40.8723802,,US,-72.431364
True,0,North America,"Philadelphia, Pennsylvania, USA",USA,39.9527237,,US,-75.1635262
True,0,North America,"Norwalk, Fairfield, Connecticut, USA",USA,41.2111039,,US,-73.4316566
True,0,North America,"Ridgefield, Fairfield, Connecticut, USA",USA,41.2814842,,US,-73.4981792
True,0,North America,"Ridgebury, Fairfield, Connecticut, USA",USA,41.3392119,,US,-73.5122771
True,0,North America,"Connecticut, USA",USA,41.6500201,,US,-72.7342163
True,0,North America,"Grand River, Ontario, Canada",Canada,43.3670861,,CA,-80.3184977
True,0,North America,"Barnstable, Massachusetts, USA",USA,41.7016936,,US,-70.3036163
True,0,North America,"Harwich, Barnstable, Massachusetts, USA",USA,41.6862224,,US,-70.0758508
True,0,North America,"Oblong, New York, USA",USA,41.5846415,,US,-73.5434695
True,0,North America,"Portage, Livingston, New York, USA",USA,42.5604851,,US,-77.9955006
True,0,North America,"Stratford, Fairfield, Connecticut, USA",USA,41.1412078,,US,-73.2637258
True,0,North America,"Cecil, Maryland, USA",USA,39.5729428,,US,-75.9381806
True,0,North America,"Earleville, Cecil, Maryland, USA",USA,39.4153912,,US,-75.9174417
True,0,North America,"Kennebunk, York, Maine, USA",USA,43.384092,,US,-70.545273
True,0,North America,"Biddeford, York, Maine, USA",USA,43.4925843,,US,-70.4533844
True,0,North America,"Tiffin, Defiance, Ohio, USA",USA,41.383501,,US,-84.5158853
True,0,North America,"St. Stephen's, Cecil, Maryland, USA",USA,39.4254064,,US,-75.9176859
True,0,North America,"Bloomington, Monroe, Indiana, USA",USA,39.1670396,,US,-86.5342881
True,0,North America,"Rehoboth, Bristol, Massachusetts, USA",USA,41.8403786,,US,-71.2494938
True,0,North America,"Swansea, Bristol, Massachusetts, USA",USA,41.7481575,,US,-71.1897684
True,0,North America,"Poughkeepsie, Dutchess, New York, USA",USA,41.7065539,,US,-73.9283672
True,0,North America,"Edgartown, Dukes, Massachusetts, USA",USA,41.3894198,,US,-70.5129682
